0,1
从不点名，最后一篇论文，给分相当可以,good
毫无压力,good
在医学部，医村信息几乎不会往外流通，有时不用上课都不知道。但是，如果你想混学分，绝对良心之选。每节课老师都不一样，课题不一样，期末写对某个课题的理解结合你的专业的论文结课。没点名，没考试。,good
不点名，期末论文，给分很高,good
写篇论文，老师不点名，趁此机会去医学部转转也挺不错，给分90+,good
不同的老师轮流授课，每人一次，期末一次论文，给分也很厚道，只是每周六早起上课实在煎熬,good
没有点过名，期末一篇论文，90+,good
没有作业，只去上了两次课，交一篇论文，90+,good
可以学习到一些与人体和环境相关的知识，也可以去医学部感受东湖路边的春天美景呀~,good
给分好,good
给分不是很高，从来不点名,bad
好高的分，好轻松的课,good
写篇论文打印出来，95分,bad
是不同的老师上课，老师没点过名，十分轻松的课，虽然是在医学部，但也是一节很不错的课，考试形式是一篇关于微生物的小论文，800字以上，给分不错吧，90+,good
期末交论文就OK，给分很不错~虽说在医学部特别远，但是不点名啊，每堂课都换一个老师。，内容还是有收获的。,good
上课+论文，无作业，内容很精采，但是后面配图略重口,good
89,good
论文很难，给分一般,bad
微助教答题签到,good
强力推荐！老师超级好，上课非常好玩，给分奈斯,good
老师会请外界人来上课，组队完成任务，，90+,good
还可以吧，事情有点多，老师人比较逗，会请一两位行业专家过来讲他们的创业历程，结课写商业计划书或者事例分析，给分还不错,good
上课会用微信小程序微助教点名，还会点人答题，中间又一次手写小作业，最后要交一篇论文或者创业计划书,good
每节课都用微信小程序签到答题，老师还会随机点同学回答问题，，期末写创业计划书（组队）或者成功案例分析（个人），85分,good
考试是一个创业策划书，可以小组合作，给分还可以，得了89.,good
很无聊的课，本来以为是生物相关，结果是创业课程，每节课微信点名，提问，还会点人回答问题。期末创业计划书或心得，给分低,bad
老师讲课还挺好的，要交一篇作业，还有一篇创业计划书，每节课都要用微助教点名和做题，给分太差了。。,bad
每节课现场答题记平时分，大作业选创业计划书给分会高。,good
这门课简直了。。胡扯的给分，跟作业质量根本是非正相关。。,bad
老师讲得还是可以的，每节课都点名，然后考核就是一次作业和一篇创业计划书或者感悟，分给得……我觉得还比较公平,good
给分太低了吧，好歹每节课都上了，作业也交了,bad
给分超级不好，事情很多,bad
有点意思，就是麻烦点，每节课还要做题,good
会用微助教上课比较坑，期末作业是写一篇创业策划,good
微信点名，上课喜欢点名回答问题，挺麻烦的，给分还好,good
用公众号点名，给分特坑。。。，排雷,bad
上课会喊人回答问题，还会网上签到，一般般一般般吧反正,good
结课可以写论文，也可以交创业计划书。内容一般般吧，但每一课网上签到。,good
这门课，每节课要随机抽人点名回答问题，而且讲的内容居然与创业有关?最恐怖的是给分这么低,bad
作业好好写，分还是挺高的,bad
偶尔点名，一次作业，结课作业，90+几乎无压力,good
每节课会随机点名，有过一次课后作业，期末是一份创业计划书，认真完成能上90,good
事情少，给分特别好，随机抽一部分人点名,good
不错,good
小论文，不点名，上课有点意思,good
挺好的，大课，点名无压力，期末一篇论文,good
一篇论文，有点卡绩，讲的不错有收获,good
老师很认真，给分也很好,good
最后交一篇论文，没有字数要求,good
老师很认真负责，内容也很好，认真的话可以学到很多东西。期末论文好好写的话90+,good
轻松有趣,good
还行,good
挺好的，不点名，最后89。,good
挺好的，有论文写得很有意思,good
考核只有最后的论文,good
期末论文，讲课有趣，老师人很好,good
一篇论文就OK啦,good
很好,good
从来不点名，老师讲课挺有意思的，最后交论文，90,good
老师挺有意思，人挺好，上课内容也不错，并且从不点名然而可能是我的结课论文写的不咋地吧，卡绩了,bad
交论文，内容挺有趣，90+,good
期末交论文，老师讲的很好，给分超良心,good
不点名，给分高,good
上课很有趣，给分很好，不点名,good
期末交一篇论文，不点名，给分一般,good
期末交论文，不点名，给分很高,good
老师直接说的，，你爱来不来，反正我不会点名哈哈哈,good
超级喜欢这个老师，老师人很好，给分良心,good
期末交论文，谈谈自己对食品安全的一些想法、上课心得之类的，有充足时间完成。老师讲课也挺不错的。,good
从不点名，讲的挺有用的，最后论文,good
几乎没有点名，考核就是一篇论文，而且是在前两节课就布置好了，随时可以交，时间非常充分。讲课内容也很有意思，会讲一些平时不知道的小常识，老师声音好听~,good
结课2000论文。老师讲的超有意思。还不点名。超级棒。安利安利。,good
结课写小论文，90+~老师时而幽默时而念ppt，感觉很博学,good
平常会有几次小作业，期末写篇论文，给分高，老师特别好。,good
上课轻松，就期末教论文,good
写了一次论文，90+,good
90+,good
给分高,good
讲的一些观点很实在，很现实，很实用，给分也很好,good
忘记点不点名了。。给分高,good
交了论文就可以了，但给分不高,bad
不点名，课没怎么去上过，最后交一篇论文，给分不错的,good
最后写论文,good
不点名。课很有意思。期末交论文，90,good
期末论文，不点名，给分不错,good
不点名，特别水，但是给分不错。特别水还体现在没有平时作业，甚至没有平时分，没有考试，只需要最后几节课去听听把期末论文的要求记一下。给分还行，90+。内容毋庸置疑，，很水，，也是新闻类的内容。。,good
没点过名，每次上两节就下课，但是论文要是写不好就......,bad
上课毫无压力，内容有点无聊，最后5000+论文,good
结课五千字论文，日常无作业,good
一般,good
老师人不错，给分也行,good
说实话，有点无聊，期末一篇5000字论文，给分还行,bad
给分一般，但是课程比较轻松,bad
老师讲材料方面的内容其实挺少的，最后的考试是一篇关于材料方面的论文，写的一般，老师给了87分,good
期末交论文5000+，很容易90+,good
事不多，期末一篇论文，虽然是ppt讲课，但平时讲的课也还不错哈，老师人挺好的,good
事不多，没怎么去也给了80多分,bad
不怎么点名，期末论文用心写选题选好点，给分还可以。,good
论文,good
点了3次名，讲的很有趣，期末一篇三千字论文给了90分,good
一次点名一次签到期末一篇论文，比较轻松,good
给分还好，点名不多,good
授课内容不错，点过两次名，平时没有作业，期末交论文，给分80+,good
两次点名，期末交论文，给分不错，论文要认真写,good
讲课仔细听还是可以了解很多知识，，三次签到，，，期末论文，，给分不错,good
有两次签到，最后交论文，我有一次没签，但是给分仍然不错，老师人不错~,good
没啥作业，写篇论文交上去，给了84.,good
论文认真写了，上课都到了90+,good
还好吧，不怎么管，交个论文就够了,good
期末交一篇论文，三次点名，给分很好。,bad
最低的一门选修，只有82吧～没什么意思,bad
考试交一篇论文，平时无作业,good
课时实在太长了……给分普通水平……,good
中间有一次展示，加分项；期末从老师给的选题里选一个写一篇论文。,good
老师讲的不错，期末是交论文，有展示,good
老师挺有趣，平时作业当点名，期末写一篇自传类的文章,good
论文结课，中期有一次老师推荐电影的观后感小论文提交，给分很好，论文只要写出自己的感受分数就比较高。老师人很好，讲课个人感觉也比较有趣，主要是关于精神分析学的，会有推荐阅读书目。只是可能最后有点小疏忽成绩漏登了，不过最后还是补上了~,good
上课超有意思，偶尔点名，会给看电影，给分也很好,good
上课挺有意思的，最后论文结课，写关于自己就行，其他不限制，但为啥给分不好？,bad
交作业变相点名，比较轻松,good
有趣，给分好,good
授课方式很有趣,good
有时会乍现幽默，课程内容比较松,good
给分奇高，上课也很轻松，也不知道怎么就94了,good
期末一篇论文，老师讲课蛮有趣的，不过公选课最低分....还卡了绩点,bad
得到了有史以来最低分。。,bad
两次作业，一次结课论文。上课还是值得听的,good
老师风趣，给分不错了,good
老师挺有趣的，课程也挺好玩,good
上起来毫无压力的课。,good
第一次课就有考勤，一共三次吧似乎。讲课蛮好的。给分的话注重原创，如果是自己写的分会比较高。,good
讲课还可以，只是我不喜欢。给分也一般，不如选章吉的课吧，室友选的他的。,bad
课程无压力，给分一般,bad
给分太低这是硬伤,bad
老师讲课很有意思，我也很有兴趣，有过一两次课堂上小互动，写的要交不知道算不算变相签到。结课是自己写一篇跟心理学有关系的论文，很可惜，我写偏了，88,good
讲的特别有趣，给分就呵呵,bad
觉得老师上课还可以，每节课都去认真听了，可能期末论文交的晚的原因，给分好低,bad
给分好低。。。,bad
老师讲课还不错，说好的给分90+呢？不过也还不错,good
老师讲课幽默风趣，期末考核很简单，1500的论文。没有平时作业，给分好。,good
很好啊,good
课很有意思，有小作业，论文；老师允许缺课，但不建议，毕竟课那么好,good
有作业，不点名，给分不咋地,bad
不点名，一个平时作业，期末手写论文。课程内容仔细听的话会学到很多。,good
还不错,good
给分还可以，内容比较基础,good
给分一般，好像内容挺有用,good
不点名，平常一个作业，结课论文，很轻松，给分好。,good
每个老师讲解的都是自己研究领域的内容，会看电影,good
给分一般般吧尽力了,bad
超级喜欢这门课！每节课都介绍一个关于心理治疗的方法，章老师讲的很引人入胜，课堂内容量很多。喜欢心理学的同学不要错过！,good
你会感受到快乐的,good
还行吧,不是很有意思,bad
课堂气氛挺好。能接触到平时接触不到的知识。给分不太好。,bad
老师讲得很有意思，作业是一篇论文还有一次小组作业，但最后得分不高。,bad
交论文的方式，老师人很好，这门课也很有用,good
一次期中作业，一次期末作业。均需手写。字数要求不高。给分？还？行？当初是90分飘过。,good
讲课内容很丰富，收获很多，给分看情况吧，写论文质量要高一点才好,good
偶尔点名，有几次作业，期末交论文，给分一般,bad
干货多，给分一般，老师人很好。,good
写过几次小文章，最后的考试是交一篇论文。老师会讲很多关于心理学的专业知识，认真去听的话是会有很大帮助的,good
每一节课都去了，90正好，老师人不错，和蔼老头,bad
90,good
老师讲课很好，会请不同的老师来讲课。,good
有平时作业啊！,good
期末论文，期间会有一些小作业，感想和问卷,good
能学到知识，很好的,good
上课内容关于心理学很有意思，有一点点课堂作业，结业论文，给分还挺好,good
有作业，期末论文，偶尔点到，讲课很有意思,good
讲课很有意思，中间会布置一些课堂作业，最后结课交一篇论文就可以了,good
这个老师脾气很好。有一次来的人很少他都不点名。只需要交一次平时作业和结课论文。,good
给分不高。,bad
老师讲课很好，很有激情，会请不同的老师来讲座。最后一节课有点名，要求看电影并参与课堂讨论期末交论文,good
期末论文,bad
老师会将心理学各个流派的知识都讲一遍，对心理学感兴趣的同学来这课就没错了~偶尔有点作业。恩，妹子很多。,good
挺有意思的一门课。最后一节课点了名，期间有一次小组展示，期末要交一篇3000字的自传，难度不大。,good
平时分小组内考核，期末一篇论文,bad
平时分是小组组内考核，期末一篇论文,bad
第一节课会分小组，平时主要课堂讨论，期末一篇论文，平时分由小组内部考核,good
上课挺轻松的就是期末不容易上90，不知道为什么,good
上课需要听，老师事情比较多，但是确实有趣。当时小组里好多人都是89，不知道老师是故意的还是什么,good
看老师，有的老师贼好贼有趣，给分不错,good
给分很好，基本没有什事情,good
蛮好的,good
一般,bad
第一节课就分组了，平时分都是小组内部考核，每节课都会问问题，小组内部出人回答。,bad
给分一般，有点无聊,bad
还不错吧,good
挺有意思的一门课，考核简单，一篇关于成长的论文，给分高,good
课堂交小作文或小测试当点名，最后写一篇论文90+,good
课堂回答问题会有加分，多回答问题没错的，但是也有回答问题，分没加上的情况,bad
只有一篇论文,good
上课比较无聊，基本上是每节课换老师，期末论文，给分一般,bad
偶尔通过课堂测验当做点名，期末交论文，90+,good
偶尔会有课堂作业，期末一篇论文，给分还行,good
会有点小作业当点名，期末写论文，课堂参与有加分,good
算是比较好玩的公选课,good
平时会有几次课堂作业，回答问题有加分，期末看部电影写心得，给分还可以~,good
上课回答问题，没回答的60+没商量,bad
4次课堂作业，最后写论文,bad
龙舟队员的专利啦~,good
最后交一篇小作文，老师讲的分厂好,good
考核是结课论文，记录咨询过程，很有意思,good
作业不多，能给到一些心理学启蒙。以两人成组互相心理咨询的方式上课，挺有趣的。作业认真写给分90+,good
要选搭档，然后每节课上课前20分钟心里咨询，考核是咨询内容的报告。不用担心要咨询什么哦，因为你会玩得开心的~,good
老师上课挺有趣的，给分好,good
分组做心理咨询,good
没有签到，但会让你在前几节课选一个搭档，每节课开始和搭档互相咨询二十分钟。最后考核就是交根据这几次课的咨询结果写的报告。给分很好，是个认识异性朋友的好机会。,good
还行,good
感觉课堂很有意思，会介绍一些心理现象和心理学学派，有几次随机的课堂作业作为点到，最后论文是分析原生家庭。,good
挺有趣的，有几次课堂作业,good
老师人很温柔，上课讲的案例挺有意思，有课堂作业，期末论文挺简单的,good
上课认真听的话能够学到东西的，而且在生活中很有用,good
偶尔有看视频交的作业。期末是对自己原生家庭分析的论文。,good
老师每周都会准备好充分的讲课内容，想要了解心理学方面的知识推荐这门课程。期末上交一篇小论文，老师会告诉我们怎么写。,good
课很有趣，有几篇论文定期末成绩,good
刚好上选修课的几周每晚都有事情去不了，分数就跪了，不过真的超有意思！~对心理学感兴趣的一定要去，一学期会有三次课堂变相点名，最后结课交一篇论文，记得叫什么《亲密关系与家庭关系？》，但是给分真的是。。负责（无辜脸,good
上课不点名，但有三次课堂作业，期末一篇论文,good
这老师真是够了，真是宁愿被挂，作为一个心理咨询老师，不知道是不是心理变态哦,bad
讲课还好吧，最后以一篇论文，中间三次作业,good
给分还不错。,good
水课必选。从不点名，但是上课其实也还行。期末一千字小论文。给分很好。,good
这个老师讲课非常无聊，打着讲视觉艺术的名号介绍风水，对西方艺术有极大偏见，期末考试是要赏析他自己的画，还鼓励学生靠把赏析他画作的文章放到网站上来加分，总之就是不要选！！！,bad
水～,good

不点名，上课还好，考试论文无压力，给分很好,good
会讲各种美的东西，很有趣,good
不点名，期末交论文，给分90+,good
论文考核，上课就欣赏电影以及瓷器？？电影有意思的。平均给分较高，但我的不高,good
其实是基础美术审美欣赏课，看了很多电影，其实讲得还可以，最后作业，轻松90+,good
给分特别好，上课特别无聊，从不点名，期末写论文，时间也很充足,bad
就去上过两次课。。期末让写一篇“中国传统艺术鉴赏”的论文，照论文打分，88.,good
还行吧，期末论文夸画作，上课一般般，给分很好,bad
标题党。。讲的基本不是这个内容。。期末论文要鉴赏老师的画作,bad
老师讲的内容很迷。。不过很水，还可以吧,bad
反正就不用去也行，期末交论文，比较容易,good
给分还行，只是没有想象中的高，老师是讲传统文化和哲学的，结课论文中国古代哲学和夸老师的画二选一，现在想想可能后者给分会更好吧。,good
挺好的一门课！！！,good
一节没去，最后写论文，给分可以,good
课比较枯燥，只有一节课，放了宫崎骏的电影，还蛮有意思，最后是写论文3000字评价老师的作品，91,bad
期末论文，不点名,good
没什么压力，从来不点名，给分也很高。推荐！,bad
考核就是写论文，从不点名，没有作业，给分90+。老师的课很有意思，推荐！,good
老师太有趣了，太有才了，给分好，从不点名，,good
最后交论文，讲课有很多关于风水的东西,good
期末写一篇论文，靠转发加分，轻松90+,good
从不点名，老师很有见解，期末一篇论文，轻松90+,good
不点名无平时作业，期末一篇论文就ok,good
作业很简单，也不点名，混学分必备,good
结课论文，点评老师画作,good
老师给分很高，，内容也不错，，期末是一篇论文，主题是赏析他的一幅画,good
非常简单，90+,good
不点名无作业无考试，期末交论文，有时讲风水五行，混学分首选,good
期末交一篇欣赏老师画作的论文，恭维一下老师就OK了，反正我是把老师和杜牧相提并论了。。。90+,good
无压力，期末就一篇论文，就是让你夸老师的画作,bad
92,good
期末一篇论文，主要是夸老师的画，从来没点名，给分不错，90+,good
一篇论文，没点名，没作业，88分,good
放ppt，，看电影的课，交论文,bad
87,good
无点名，结课一篇鉴赏论文,good
不点名，无作业，期末要写一篇关于老师本人作品的论文，给分不错90+。,good
平时无作业不点名，上课会看一些视频，最后一篇论文，是鉴赏老师画作的，给分好像不错,good
讲课内容挺丰富的。期末写鉴赏老师作品的论文，给分很好90+。良心课~,good
从不点名，期末是写一篇鉴赏老师自己画作的论文，给分较高（本人期末95分，觉得自己写的论文还不错是高分的原因，需要者请电联18075083260）,good
上课从不点名，还会放一些电影或电视剧，没有作业，期末写一篇鉴赏性论文，给分还不错,good
没考勤，讲得还算有意思。交论文就好了，给分很好，上90了,good
老师人超好，期末论文,good
不用去上课，论文结课，87,good
论文考核,good
很好,good
没点过名，上课放电影或讲一些东西，期末交论文，给分不是很高，85,bad
不点名，写论文，85+,good
看电影课，完事抄篇论文,good
一篇论文就OK了，上课很无聊,bad
不点名。没有考试，期末论文2000字以上就能保证80+,good
不点名不签到无平时作业，期末交论文,good
只去了听了一次好惭愧。给分还行，也不是特好。,bad
会放电影,good
最后交一篇论文就OK,bad
会经常放视频看，结课的时候交一篇论文就好了。,good
不点名，期末论文,good
不到平均分的课。。。,bad
就是点名，2到3次吧，不定期的期末开卷考试，超简单,good
上课比较无聊，平时从不点名，最后开卷考试，但被卡了绩点，不太爽,bad
开卷考试，偶尔点到,good
给分不错94，老师偶尔会安排签到,good
点名一次。一次展示。期末开卷。90+,good
最后开卷考试，给分还可以,good
点过一次名。三节课前两节老师就是在读课本第三节看纪录片或者电影。期末开卷考试，照着课本抄基本就90+。讲ppt可加分。水课，讲的没意思除非自己感兴趣，适合混学分。,good
只点一次名，也没关系，最后开卷考，90+,good
会随机走到你面前问问题。不点名。期末开卷。给分可以,good
开卷考，给分高，，点过一次名,good
还行吧，有几次没去，最后考试开卷，买相关书籍即可，88分。,good
抄了书才81，感觉答案都在书上找到了,good
开卷考试，会要求买一本老师编的书，考的内容上面都有讲PPT可以加分,good
听说会不定期点名，结果一学期下来一次也没点。老师上课会随意点人起来回答问题，不过基本上跟成绩不挂钩。期末考核是开卷考试，买了老师的书，内容上面都可以找到，给分高,good
开卷考试，买本书就好，给分90+,good
开卷考试，刚开始要买本书，书上都有内容。,good
95，期末开卷，有做展示的分数也不一定特别高,bad
得买老师出的书，期末就找上面抄。有次主动展示的机会，但展示了分也不一定有没展示的高，展示会有90+，,good
期末开卷考，借的学姐的书，跟之前考的内容基本都是一样的。展示是自愿的，老师给分很好。,good
每次最后一节课放视频，中间不点名，期末开卷考试。总之良心好课,good
点过一次名，最后开卷考试，要买书,bad
不定时点名，没有作业，看纪录片，期末开卷考，加分项是展示，很多80+,good
有一次可参加可不参加的课堂展示，期末开卷考试，只要提前借好老师的那本《科学技术史》基本无压力高分。,good
全程就点过一次名，不过那天好像是第二天有个假期还是怎样，好多人没去，都中枪了...有一次展示的机会可以加点分,bad
开卷考试，貌似不买课本去考会死……,bad
点过一次名，每次最后一节课放视频，考试开卷几乎抄书，买教材，给分很高,bad
偶尔点名，最后开卷考试，考试有一本他编的书就90+,bad
没什么意思。。。给分还好，开卷考试，没有作业,good
期末是开卷考，点名只点了一次，最后给了90+,good
有两次不规律点名，讲课超级无聊，需要买指定教材，考试抄书即可，给分至少80+。,good
没有作业，偶尔点名，考试开卷简单，给分高！！点名未到一次，最后89,good
简直不能更好的一个课！,good
最后一节课点名，花一节课来点名。讲课完全照本宣科，考试的时候只要买了他的书，照抄妥妥的。不过给分一般。只给了我86。,bad
给分不错,good
没有作业，偶尔点名，开卷考试（要买老师的教材），第三节课都是放视频。,good
闹眼子挺好的,good
一般,good
超好,good
会点三次名，期末拿题回去做，挺有意思,good
期末论文，解释卦象，给分较低,good
超级有意思！,good
讲的有意思就是给分emmmm,bad
没有兴趣就不要选了，选了你也考不高,good
期末写篇论文，随机点名三次，给分很一般。。,good
十三次课随机点名三次，期末交一份作业算考试成绩，基本是ppt和讲过的原题，最后得了90,good
讲八卦五行之类算命的东西，本来对这方面没什么兴趣，但发现跟着老师听一听还是蛮有意思的。期末布置三道题自己回去写，感觉自己全靠瞎扯，没想到还拿了90+,good
点三次名，最后开卷考,good
对数术文化感兴趣的人可能会很喜欢这门课吧，老师人也很好，期末开卷考试，偶尔点名,good
随机点名三次，讲课内容为史书中数术相关内容，考核方式是提前一周给两道题，题目不难上网搜也可以搜到，给分一般，有点玄学，老师讲话有点口音，坐得远听不清,bad
没有对周易等古代卜卦占星等相关知识有兴趣的慎选，老师有比较重的口音，坐远了根本听不懂，只有期末作业两道题，我让国学专业的帮我做了只有80,bad
最后交期末作业，老师提前告诉题目，不难，注意老师上课提到的重点就行,good
