0,1
讲的是竞赛的题目，建议想参加大学生数学竞赛或想提高自己数学水平的人选这门课。有两个老师讲，对应着高数上下的内容，先是樊启斌教授，后是湛少峰教授，讲的都不错。,good
老师主要是课堂上微信签到，最后交两个PPT作业，给分82分，主要看运气吧,good
只讲PPT，讲课内容超实用，期末交作业，给分很好,good
这门课真的很好！！有干货实用而且给分还好！老师也很可爱！,good
老师超好！干货很多！,good
老师上课很有趣，讲解如何制作PPT，干货很多，期末要求交两个PPT和一个Word，给分很迷。,bad
主要讲授如何制作PPT，期末考核是制作一份“阅读型”PPT和“演讲型”PPT，外加一份word说明，不点名，给分高，能学到东西，五星推荐,good
上课是教ppt制作，期末交两个ppt和一个word，从不点名，老师人很好，讲的也不错,good
上课是教ppt制作，期末交两个ppt和一个word，从不点名，老师人很好，讲的也不错,good
讲课超有意思，学了之后感觉世界观的变了，真的能学到很多。,good
最后交两个ppt，平常十分轻松,good
老师人很有趣，讲课也好，作业要认真做，88分,good
讲得很好但是给分尴尬，要是只想混学分的话建议不要选,bad
认真听会学到一些东西，期末两个PPT一个WORD，给分还不错,good
还行，交的两个ppt,good
不点名，讲课内容很实用，期末交两个ppt，一个Word文档，给分比较严格。,bad
老师讲的很好啊，课堂有趣，不考试，不点名，最后80，不过怪我自己没好好做。,good
讲的很好，就是给分不是很高,bad
很实用，可惜自己没有好好学-，-,bad
期末我没有认真做结课作业所以分超低QAQ，但是我其他同学分数不错，希望大家吸取我的教训。,bad
不点名，上课就是老师操作最好带电脑去要不然很蒙逼，期末交PPT,good
挺实用的，最好每次上课带着电脑跟老师一起操作,good
讲课有意思，能学到东西，但是期末交了一个自以为超级赞的PPT，才80多分，身边同学随便做的不好看的PPT也是这个分，老师你出来我们打一架,bad
老师很认真，给分90+，相当轻松。没有点到，最后交自己做的ppt就好。,good
90,good
老师讲课不错，干货挺多的，也很实用。最后是交两个ppt和一个word。唯一美中不足的是给分实在是呵呵哒，我周围没有一个人85+的，怀疑老师没有拿到年终奖。可以去蹭，但是不要选！！！！,bad
平时无作业，边将边演示，其实只讲ppt的制作，考试就是交两份ppt和一份word介绍。,good
讲PPT制作，非常有收获，老师讲的也很好，可以学到ppt的很多东西，结课交几个作品，很简单，给分很好。,good
好像不点名，没有作业，老师讲得很有意思，学的ppt制作方法也非常有用，期末没有考试，交两个ppt作业和一份word文档记录制作ppt的心得之类就行，分很高,good
课上的有趣，老师不点名，但是分数相当低！,bad
学到很多，尤其是PPT的制作，如果没怎么好好上课，结课作业可能就会有点问题了，最后就是做一份PPT再写一份你制作这份ppt的思路报告,good
老师幽默风趣，干货满满，给分90+,good
只讲了PPT的内容，老师很风趣，内容很实用,good
老师给分很好的，期末做两个ppt就可以啦，只要是用心做的分都高,good
威胁点名其实好像没点过吧，，,good
课不错，老师讲的很好，风趣幽默，能学到东西，就是给分不太高,bad
棒,good
老师讲的极好而且真的可以学到很多东西。作业是最后交两个ppt一个word。给分还不知道……,good
老师颜值高讲得好，节节课笑点无数，从不点名，无课堂作业，结课作业的ppt做得好的话给分90+,good
不点名，讲的好，教你做PPT，最后要交两个PPT，能学到一些,good
不错,good
垃圾老师，水课,bad
老师真的超级好,good
真的超好，强烈推荐。轻松90+,good
给分非常好，事情有点多,good
小组展示，结课800字手写论文，帮老师填问卷会有加分，90+,good
每学期回答两次问题，小组作业一次，期末做问卷算入平时分。期末是一篇小论文。给分很好！,good
给分分为上课发言和小组展示以及论文，所以要把握好发言机会，给分挺好的,good
给分超好，老师给你很多加分的机会,good
小组任务,good
上课回答问题，展示＋论文，给分好,good
点大概三次名，平时要分小组做ppt或者小视频，然后期末交一篇论文（....老师还邀请你去医学部找他聊天，会有加分）,good
偶尔通过QQ群填问卷点名。期末是小组做PPT或者小视频。很轻松的一门课。给分超好！,good
要积极发言哦，还要有一次小组展示，给分好,good
小组展示，经常点名，上课要回答问题。给分90+。,good
有3次点名，课堂回答问题加分，最后写论文,good
给分很好，点3次名，就是事情有点多，要求最低上课回答问题的次数，还有要有小组展示（只准少部分小组用ppt，其他组要求用情景剧等多种形式），最后还要2000字结课论文（手写）。,good
三次点名，去老师办公室主动交流有加分，好多90+的，有小组展示，平时讲的东西比较大众，不存在理解问题，要求发言两次以上,good
90+，给分可以,good
有三次点名，是写名字的纸条交上去。这个课要求上课举手发言超过三次，小组展示一次，不过都好说。最后交一篇手写论文，给分90+,good
微助教签到答题，期末提前一周给试卷题目，每次课都签到、答题，试卷认真查文献、课件做的，最后85，给分有点迷,bad
期末卷子拿回去自己写，有一次展示,good
每节课微助教签到，一次小组展示（人站在讲台上）。期末答题拿回去写。觉得不是很有意思哎。,bad
微信签到，期末试卷会提前发，有一个小组展示,good
老师人很好,good
有趣的课，考试也不难,good
平时会签到，有个集体展示，给分一般,good
微助教签到，考试开卷，给题目回去写,good
很水，考核也简单，分数给得有点随意,good
微助教签到，开卷考试提前一周给题目,good
考勤不记得了，给分还行。,good
有一次展示，最后卷子拿回去做，认真点分数不会低,good
这门课给我分特别高...上课有随机问题，微助教签到,good
给分低,bad
给分一般，不怎么点名，轻松，讲课适合睡眠,good
PPT展示，试卷带回自己写，给分不高,good
无聊,bad
平时微信点名做题，老师讲的很好，一次小组ppt展示，结课一张卷子带回去做,good
两位老师来讲课，覆盖的面算比较全面，听一听对生活也有帮助。每节课用微助教签到，有时还会用微助教做题，有一次小组展示，讲完以后全组人上去，老师点评，然后会对个别成员进行提问，期末试卷传到群里自己做好后下一周交。给分还不错,good
这次给分不高,good
手机签到，试卷拿回去自己完成，有小组PPT展示。给分可以,good
手机签到，开卷考试，小组ppt展示，给分高。,good
有展示，每节课都手机签到，最后开卷带回去考试,good
咦惹,good
感兴趣，但上课可以水，给分高，最后发张卷子一个星期交,good
开卷，试卷要带回去认真做，平时上课要微助教点名做题，还有一个小组展示，没有其他作业,good
期末展示，平常课堂会有提问,good
期末有一份题目回去做完最后一次课交。有一次课堂小组展示，但是不计入成绩。平时喜欢用微助教答题互动。基本上是干货，有利身心健康。,good
老师讲的很好，给分也很好，期末考试提前一周把卷子发下来，网上有原题,good
很迷，每节课都去作业都做，但是给分太差了,bad
每次签到，还有与成绩无关的展示，最后交试卷，85.讲的还可以,good
每节课微信签到，可能有微信答题，每节课都去，最后的发下去的卷子认真写，给分还是很好的。老师很有激情,good
第一次公选，给分好低啊,bad
课下讨论+课堂展示+课后一套试题，给分卡绩，明明答案都是对着生化书和卫生学书写的，只给89,bad
经常花式点名，没办法代答到的那种，但是最后考核很简单，给分不错,bad
老师讲的还是很好的。知识也还很实用，每节课都微信定位签到，有时候会在微助教上写题。期末考试是一套问卷，我的分还行，但是我们群里有人说分很低。,good
必选课，92,good
给分很好，每次点名，期末试卷考试,good
每节课都要微助教签到，不能旷课啊，每节课都要在微助教上做题，需要小组准备一个PPT，最后做一份问卷就好，给分还可以。,bad
给分好，每节课点名，开卷考试，水课,good
开卷考，我和同学的分都低得莫名其妙,bad
每节课微信签到，还会用微信回答问题，有一次小组展示，最后给卷子拿回去做，给分好,good
很好，老师上课认真，签到严格。期末开卷，小组演讲,good
给分很好，基本没有什事情,good
老师人很好，但是每节课都要微信签到，给分很好,good
基本上每节课微信点名，但是老师很好准备的很认真，学到很多东西，给分也不错，推荐,good
最后有张卷子自己带回去做（老师发邮箱）课堂上用微信公众号签到和提问,good
每节课手机定位签到，课堂上要用公众号回答问题。有一个展示。最后卷子提前发下来带回去做，给分很高,good
老师上课认真，授课内容很有意思十分实用。期末应该是有试卷带回去自己做，不过因为作业发到邮箱没看到所以还是在课堂上完成的。,good
除了每节课点名其他都还好，期末开卷拿回去做网上都有答案，填一个健康测试就行，给分好,good
挺有趣的，就是事有点多，但是给分好,good
每节课都用微信点名，，，不建议医学生选，因为没啥意思，期末要做一个小组展示,bad
老师人很好，很儒雅的感觉2333事也不多，给分也很好！,good
有一次课堂展示，有一次作业（开卷）,good
85，每节课微信签到答题，事情特别多，慎选,bad
千万别选，16年开始每节课点名，反正我每节课都去了，考试参考网上的答案，我也只有77。,bad
这门课还是挺不错的一门公选，老师会跟你介绍一些人体必不可少的元素，然后微信签到，每节课都会签到！黑暗的高科技还会定位你是否在教室！不过考核还是挺简单的，一个健康调查表、一份试卷。期末95！,good
每次点名，有一个小作业，还有，小组ppt演讲，不担任主要角色就八十+而已,bad
每节课微信点名，，考试卷子发回去做,good
开卷考试,bad
小组合作？还有这种东西，明明每节课有去啊,good
没作业，不点名但是要在微信上签到，上课人超多，不是特别愿意听。期末开卷，网上有答案,good
讲的内容还是很有趣的，每节课都要微信签到，最后开卷，很水~拿高分很容易,good
很有用！学习一下！,good
填一份关于自己健康认识的问卷，期末小组做一个展示。感觉是被队友坑了，展示的队友支支吾吾墨迹老半天，最后老师给了76，所以一定展示要选好人。,bad
课上挺轻松，有一个问卷有一个带回去的考卷最后，就是分不高,good
会点名，，期末一篇论文，90+,good
88，还可以，主要是我每次都坐在第一排，老师偶尔点名,good
一份调查问卷，第一次课一定要去！,good
点名三次，小组合作以及一篇论文,good
结束的时候给分有点低，这也跟我作业应付有关系啦,good
点名3次，给分一般,good
偶尔点点名，最后有个小组展示，期末有张卷子自己带回来写带过去交就可以了。,good
课挺无聊但容易过。。试卷自己打印做了交，网上有答案,good
点过3次名大概。当作普及知识听故事也很好，虽然现在忘得差不多了。小组7~8人左右一起分工展示。还要交讨论记录。小组中同学也有分数差别蛮大的。85+,good
考试开卷，轻松90+,good
不是很推荐这门课。给分88，卡绩点真的。上课会隔几节课抽点名，上课感觉就是讲养生了233，考试有，填写问卷+，试卷（带回去写，网上都有答案）+，最后小组课题，展示。课题展示队友一定要找好！！！！！最好宿舍组队吧，不熟悉的人实在是.....,good
平时都是讲一些健康养生知识，一般第二节课点名，点名时间不确定，期末就一次小组展示加一个小作业，网上都有答案==，94。，good
一定要找好队友，一定要！！！当时找的化院一个男生，平时信誓旦旦最后撂挑子找不到人，都弄完了忽然冒出来了还有理有据（小组其他人都是女生）。,bad
卡绩点你怎么事,bad
业界良心！！！,good
心痛不说了被卡绩点,bad
挺有趣的课，老师不一定是田卫群可能是其他人来上课。普及医学知识挺有趣的，对健康认识更加深入。结课会有一份卷子课后去做最后一节课交过去。最后几节课是小组展示，分数很大一部分是小组展示的好坏。,good
期末论文,good
给分蛮好,good
就一篇论文，非常好,good
老师学术很厉害,good
老师讲的很好，是个大牛手写论文结课，用心写，并且引用数据图文之类的，给分95,good
论文结课，不点名，给分挺好,good
手写论文，给分可以,good
老师很好，讲的事情很有吸引力,good
不点名，期末一篇论文，给分一般,good
没有点过名，无作业，考核交一篇论文就行，给分挺好的,good
手写结课论文,good
比较水,good
汪的华老师是个非常厉害的老师，讲课还是很有深度的，推荐。,good
平时没点过名，考核是写一篇论文，比较水，好好写写有90+,good
论文,good
老师上课认真听还是能有一些思考的！期末论文，给分90+,good
老师讲得挺好的，结课交手写论文，90+,good
结课手写论文，90+,good
特别好,good
最后写一篇论文，90+,good
老师挺好的，每节课都要看ted视频，有点名，期末论文给分还可以,good
3000字手写论文,good
老师人很好哦，给分很棒,good
写论文，给分高，，老师人很好,good
很好,good
老师有点萌萌哒,good
两次论文，没有考试,bad
很有意思的课。,good
老师超级niceeee！！！,good
期末论文，不点名90+老师超nice,good
讲课很有意思，给分很好,good
讲得很好玩超级推荐！,good
老师很有趣，期末交个创意报告,good
期末论文，老师很好,good
给分好，讲得好，点名基本上毫无压力,good
老师上课很有趣，期末写论文，给分很棒,good
老师人很好，nice！给分也很高,good
老师超级nice的，讲课很有趣，期末交一篇论文，没什么压力，给分很好,good
期末一篇论文，没有考试，轻松90,good
讲的内容很棒，期末从选题里写论文，给分不错,good
上课带我们玩数独、小鳄鱼、德州扑克什么的，结课一篇论文，描述自己的想法就行，连资料都不用查的那种,good
很有趣，还带领我们炒股,good
上课用微信点到，讲课有点用,good
作业就最后的一篇论文，老师挺有趣的，给分也很好,good
老师是真的好得没的说，上课打牌赢了的钱发红包，给分超级好~,good
人特别好，给分特好,good
给分很好,good
给分很好，不考勤最后交论文。论文迟交了，和老师道歉补交，没有影响分数。,good
讲课生动，给分好,good
很有趣的老师，给分好，课堂气氛活跃，讲的东西很有趣,good
老师讲的很好,good
给分很好，论文结课,good
考核方式是写小论文，可以迟交，老师很有意思,good
老师人很好,good
老师人很好,good
老师上课很有趣，有一次课堂作业，期末交一份APP创意论文就行，给分很好,good
老师超好，讲课引人入胜，内容都很有趣，期末交论文，老师给题目，自拟也可以,good
期末论文，老师人很好,good
被卡绩了,good
老师人好，上课有趣，给分高，期末交论文,good
上课好玩儿，给分轻松90+,good
老师人特好，没去过，90+,good
老师很认真负责，但是为了照顾没有相应软件知识的同学所以问题分析的都不深入，最后交一篇论文，大约三次课堂作业。,good
老师人超好，上课也很有趣，有一次课堂作业，期末论文，超级推荐啊！！,good
老师很好，作业也不难,good
老师人很好,good
老师真的超好，给分也很高，很简单,good
老师超级好！有一次课堂作业（变相点名）但会在群里提前说，上的课也很有趣，给分高,good
给分好，最后写论文，上课老师带着玩手机游戏,good
老师讲课很棒，最后交一次论文轻松90+,good
老师明确说了不会为难大家,good
很有新意能了解到很多看书看不到的东西，，，老师很有趣啊~,good
给分良心，不点名，老师讲的很好,good
有点儿水，点名给加了分不给扣分，上课老师打德州扑克。。。有点儿意思,good
推荐，最后写一篇论文，90分。,good
从来不点名，期末交一个自己创意APP，很简单，受益匪浅，91,good
老师上课挺有趣，本身就不是很学术或者说很有用的课，事少，最后论文APP设计创意，我本身也觉得挺有趣，大开脑洞的好机会,good
老师很有有趣，眼光很长远，课程非常有意思，最后大作业设计app，很简单，很实际,good
有两次课堂作业，交一次就OK，期末交一篇论文，给分超好,good
给分真是，太！好！了！而且老师很好说话！,good
不点名，会有一次课堂作业，期末交app设计方案，轻松90+，墙裂推荐,good
老头好有意思，一定要选这门课啊,good
老师特别好,good
这个课很有趣，可惜今年没有了，轻松90+，一篇论文，不用学任何代码等专业知识,good
老师很幽默。产品经理们可以选，想写程序的得选这位老师的另一门课了。,good
给分非常好，讲课非常有趣，一次作业，一次论文，无考试。,good
有几个小作业，老师非常幽默，而且老师给分很好~90+，强推,good
老师非常有趣！课堂气氛特别好。给分也很高。,good
老师很有趣讲炒股啊什么的，不过最后有点卡绩点，期末是根据自己的专业设计一个APP，构想,bad
老师很棒！！,good
老师人很好啊，讲课也很好玩，很强调创意，值得听，并且给分也不错,good
挺好的吧，老师人很好,good
无聊,bad
小论文，强烈推荐,good
上课很有趣，不是叫老师的赌博经历，就是看老师玩手机，期末交一篇论文，给分科学。,good
基本不点到，只是有一次上课用纸条回答，期末一篇论文，给分很好，而且老师讲课很有趣上课还给我们演示德州扑克怎么玩,good
简单有意思的课，最后结课是设计了一个app界面？老师说不会做用手画都行哈哈，96,good
老师贼有意思，给分很好,good
老师很有趣~,good
老师是个很幽默风趣的老头，思维活跃，推荐,good
老师人超级好！讲课很有趣！给分也赞，而且大一可以选上！不过也就第一天可以…,good
不点名，老师会推荐一些有趣的APP，给分良心,good
给分高,bad
中间只有一次点名，是写一个App交上去，课堂有趣，期末写一篇小论文，感觉字数够多就可以，后来我都没去了，但论文写的多，也有90+,good
中间有一次课会提问，当堂交。老师超级有趣，讲课风格幽默。期末交一篇对某个创意的想法，很随意，不算论文。我当堂交的作业都没听清什么问题，最后给分还是90+,good
无点名无考试，期末交一个简单的作业就85+，平时讲课也很好玩，碰上假期补课老师还会取消那次课,good
从不点名，只需最后交个作业，作业也很简单，给分很赞,good
第一次课有写个常用app当课堂作业，没做的之后可以补。讲的很好，都是干货。最后交论文分析app或者自己想一个app，感觉自己想的app的分数会比较高,good
老师很风趣，给分也很好,good
老师讲课很好，很风趣~,good
上课无压力，绝对好课,good
结课写分析app，但给分不是特别高,bad
上课相当轻松，老师讲课幽默风趣，还会演示各种手机app和游戏，有节课讲手机游戏，结果玩了3节课游戏o(∩_∩)o，,good
只要交了作业什么都好说，上课质量还不错,good
除了给我的分太低了！！！（生气+10086）其他还是蛮好的,good
不点名，但最后我跟我朋友都是84分T^T哭晕T^T,bad
最后的作业是写一篇论文，老师讲得很有趣,good
只有六节课，随机一节课交作业算点名，只有一次。最后作业交一个手机APP的脑洞，或者一个手机app的分析，很简单。老师人也很好。,good
没有点名，老师幽默，课程有趣，论文简单。,good
考核很简单，老师人很好,good
老师上课很有趣，考核完全无压力。,good
还不错,good
老师讲课很有意思~考核可以代签，最后的论文自己随便想了一个app交上去，居然也有90+,good
很好的一门课哦，不去也没事，去了收获也不小，最后交一篇论文就OK了,good
选了绝对不会后悔~,good
最后一次课当堂论文，无点名无考试；给分很高90+；老师是个很幽默的老头，人很nice，介绍一些有创意的手机应用，并教给你想出创意的方法，很有启发,good
老师人很好，给分也高。,good
虽然老师看起来有点年纪，但实际上很与时俱进233给分还不错,good
很多次不去期末作业都晚交还给我90,good
考核方式就是一篇论文，讲这节课与自己专业的关系，给分很好，老师很好，会提前一会儿下课，good
缺点就是在医学部上课，太远了,bad
医学部第一水课，一节课不来，写个800字小论文，90＋,good
课讲的不错，每节课都换人，从不点名，期末一篇论文就好，给分不错,good
最后写论文，不点名，给分不错,good
不点名，最后写论文，反正还行,good
结课一篇论文，说的是800字写出自己的感想就好，给分很迷。结课后问老师，老师说你应该多写点，1500太少了，多查点文献，把查到的组织起来……so，自己的感想？,good
给分很迷,bad
老师很好，上课人很多，最后小论文，给分不错,good
水课，不点名，期末交论文,good
期末一篇1000字的文章,good
给分高,good
每节课换老师，考勤无压力，最后一篇论文,good
从来没去过，最后交一篇论文，90＋,good
从不点名，每节课换老师，最后一篇小论文，好像85+,good
太远了，不点名，期末交论文，86有点难过,good
噢力给,good

给分不错，拓展知识面，不点名,good
浑学分的课Emm....每次去医学部上课都顺便去汉街吃吃吃,good
医学部的课，没上过几节课最后交一篇论文，给分90+,good
每节课一个老师，不点名，最后交个论文,good
我选的医学部的，，超级远~~不过给分啥的都超级好，，想运动一下的话，就走过去嘞~~就当锻炼了。噗哈哈,good
水课，从不点名，期末论文，给分90+,good
就交一篇论文，给分，，，我反正没上九十，嘤嘤嘤,bad
期末感想。不点名。90+,good
课少不点名期末论文90+,good
还不错，不点名，期末写论文，给分高，大部分都是90+，但是上课没意思。,bad
写一篇论文，不点名，给分好,good
有个姓李（具体真忘了）的年纪比较大的老师讲的真心好，每节课换一个老师。期末交论文,good
给分挺高,good
每节课基本都是不同的老师上课，讲一些通俗易懂的内容。期末交一份课程内容相关的手写论文，最好有自己的思考，给分不错，如果需要凑学分，是个不错的选择。,good
不点名，交论文，给分高,good
不点名，论文超级超级超级简单。,bad
不点名，经常换老师，结课论文很简单，分数也很高,good
没去过　交了论文　９０＋,good
从来都不点到，只有一个期末论文，但是不知道为什么没有90+，论文写的太差了？,bad
给分特别高，就是周末跑医村有点远，期末交论文,good
交论文，基本上讲一些科普知识，给分超高的,good
给分高，不点名，最后一节课交论文。,good
全部90分…不点名无作业…最后交论文,good
老师超级好啊！从不点名，一篇论文，给分也很高！就是医学部有点远,good
论文，水课,good
从来没上过课，交了一篇论文得了90,good
教授授课，人很好，喜欢摄影，还邀请我们加他qq，空间里全都是老师的摄影作品。从不点名，因为学医，算是提前接触微生物了，期末论文一篇，轻松！！,good
因为在医村好几次迟到了就没去，不过不点名，很好过，90+。讲的课有的时候还挺有意思的,good
不点名，交一篇论文，给分很好，虽然不考勤还是建议大家去一下，毕竟那么大的教室只有十几个人老师可能也会不太开心，就当早起去医学部自习写作业也好啊~，而且讲的内容其实很贴近生活很有用的,good
